{
  "schema_version": 1,
  "profile_id": "portfolio-local",
  "description": "Reference MCP profile for portfolio governance repo local development.",
  "default_tier": "dev",
  "credential_policy": {
    "forbidden_in_tiers": ["dev"],
    "human_gate_tiers": ["production"]
  },
  "tiers": {
    "dev": {
      "description": "Local IDE and cloud-agent dry runs against localhost or mocks.",
      "mcp_servers": {
        "filesystem": {
          "enabled": true,
          "transport": "stdio",
          "command": "npx",
          "args": [
            "-y",
            "@modelcontextprotocol/server-filesystem",
            "/workspace"
          ],
          "credential_refs": [],
          "notes": "Read-only workspace access for agent tooling smoke tests."
        }
      }
    },
    "staging": {
      "description": "Shared staging workers with staging-scoped credentials.",
      "mcp_servers": {
        "github": {
          "enabled": true,
          "transport": "streamable_http",
          "url": "https://staging-mcp.example.com/github",
          "credential_refs": ["GITHUB_MCP_TOKEN"],
          "notes": "Staging token only; never reuse production credentials."
        }
      }
    },
    "production": {
      "description": "Approved release workflows only; operator gate required.",
      "mcp_servers": {
        "deploy": {
          "enabled": false,
          "transport": "streamable_http",
          "url": "https://mcp.example.com/deploy",
          "credential_refs": ["DEPLOY_MCP_TOKEN"],
          "notes": "Disabled by default until operator enables per release."
        },
        "drake": {
          "enabled": false,
          "transport": "streamable_http",
          "url": "https://mcp.example.com/drake",
          "credential_refs": ["DRAKE_MCP_API_KEY"],
          "notes": "Path-routed Drake orchestration MCP. Use DRAKE_MCP_BASE_URL env var. Operator-gated."
        }
      }
    }
  }
}
